### ISSUE TITLE
I've successfully installed this script, the Endpoint port is 52757, but I can't connect to the network

### ISSUE THREAD

**Issue by qnyblog** [burghardt/easy-wg-quick#67]
I've successfully installed this script, the Endpoint port is 52757, but I can't connect to the network
i set a Custom	UDP rule use UFW
Status: active

To                         Action      From
--                         ------      ----
52757/udp                  ALLOW       Anywhere
52757/udp (v6)             ALLOW       Anywhere (v6)

i also set a Custom	UDP	Inbound Rule 52757 in DigitalOcean
But still can't connect to the network, please help, thank you

**Comment by burghardt** [comment]
Glad to see you managed to install dependencies (#66). Did you do any customizations to `easy-wg-quick` configuration? What exactly doesn't work for you?

**Comment by qnyblog** [comment]
i do these:
sudo apt update && sudo apt upgrade -y
sudo apt install wireguard-tools mawk grep iproute2 qrencode
wget https://raw.githubusercontent.com/burghardt/easy-wg-quick/master/easy-wg-quick
chmod +x easy-wg-quick
./easy-wg-quick wp345

and use wgclient_wp345.conf in Wireguard Windows Client, the problem is that when i click activate button, and shows connected, but Receive 0 B, send 296 B, so i can't connect to the network

**Comment by burghardt** [comment]
It looks like the Wireguard traffic never reaches the VPN hub, or the reply never comes to the client. Let's try to verify which case it is.

Could you run `tcpdump -i <physical network device> 'udp <port your configuration use for Wireguard traffic>'` and see if there is any traffic to the server and from the server to the client?

If there is traffic on the physical interface, but Wireguard doesn't see it (verify with `wg show`), it could be a VPN hub firewalling issue. If no traffic is ever seen, a cloud provider firewalling configuration issue is possible (i.e. hypervisor level firewall). Check with the provider's WebUI for firewall misconfiguration.

For further investigation, please post `iptables -vnxL -t filter`, `iptables -vnxL -t nat`, `wg show`, and screenshot from WebUI firewall rules. Please redact sensitive information.

**Comment by burghardt** [comment]
Closing as inactive.

**Comment by avently** [comment]
Hi, Krzysztof! Thank you for this great script. Saved a couple of days digging in wireguard documentation.

I setup one VPS with your script (Manjaro), works good (except the config contains incorrect external IP of VPS, so I changed it and it works).
The problem is my other VPSes don't work. One is on Ubuntu and second is on Manjaro. These two from other provider so network setup probably different and causes issues.

This issue seems relevant to my case.

> Could you run tcpdump -i <physical network device> 'udp <port your configuration use for Wireguard traffic>' and see if there is any traffic to the server and from the server to the client?

```
sudo tcpdump -i ens3 port 4473
23:49:38.910345 IP vpshostnamereducted.4473 > 45.115.101.226.31112: UDP, length 32
23:49:39.182916 IP 45.115.101.226.31112 > vpshostnamereducted.4473: UDP, length 128
23:49:40.241390 IP 45.115.101.226.31112 > vpshostnamereducted.4473: UDP, length 128
23:49:41.209750 IP 45.115.101.226.31112 > vpshostnamereducted.4473: UDP, length 128
23:49:42.222992 IP 45.115.101.226.31112 > vpshostnamereducted.4473: UDP, length 128
23:49:43.266647 IP 45.115.101.226.31112 > vpshostnamereducted.4473: UDP, length 128
23:49:44.264288 IP 45.115.101.226.31112 > vpshostnamereducted.4473: UDP, length 128
23:49:45.282648 IP 45.115.101.226.31112 > vpshostnamereducted.4473: UDP, length 128
23:49:45.729201 IP 45.115.101.226.31112 > vpshostnamereducted.4473: UDP, length 96
23:49:45.730107 IP 45.115.101.226.31112 > vpshostnamereducted.4473: UDP, length 96
23:49:46.288714 IP 45.115.101.226.31112 > vpshostnamereducted.4473: UDP, length 128
23:49:47.301917 IP 45.115.101.226.31112 > vpshostnamereducted.4473: UDP, length 128
23:49:48.316970 IP 45.115.101.226.31112 > vpshostnamereducted.4473: UDP, length 128
23:49:48.693693 IP 45.115.101.226.31112 > vpshostnamereducted.4473: UDP, length 96
23:49:49.329808 IP 45.115.101.226.31112 > vpshostnamereducted.4473: UDP, length 128
23:49:49.363824 IP vpshostnamereducted.4473 > 45.115.101.226.31112: UDP, length 32
```

> If no traffic is ever seen, a cloud provider firewalling configuration issue is possible (i.e. hypervisor level firewall). Check with the provider's WebUI for firewall misconfiguration.

There is no UI for managing any firewall rules in provider's web panel. How can I be sure that the problem is on provider's side or on my side?


> For further investigation, please post iptables -vnxL -t filter, iptables -vnxL -t nat, wg show
```
sudo iptables -vnxL -t filter
Chain INPUT (policy ACCEPT 207 packets, 17274 bytes)
    pkts      bytes target     prot opt in     out     source               destination

Chain FORWARD (policy DROP 53 packets, 4172 bytes)
    pkts      bytes target     prot opt in     out     source               destination
      59     4292 ACCEPT     all  --  wghub  *       0.0.0.0/0            0.0.0.0/0

Chain OUTPUT (policy ACCEPT 124 packets, 66398 bytes)
    pkts      bytes target     prot opt in     out     source               destination

Chain DOCKER (0 references)
    pkts      bytes target     prot opt in     out     source               destination

Chain DOCKER-ISOLATION-STAGE-1 (0 references)
    pkts      bytes target     prot opt in     out     source               destination

Chain DOCKER-ISOLATION-STAGE-2 (0 references)
    pkts      bytes target     prot opt in     out     source               destination

Chain DOCKER-USER (0 references)
    pkts      bytes target     prot opt in     out     source               destination


sudo iptables -vnxL -t nat

Chain PREROUTING (policy ACCEPT 58 packets, 3254 bytes)
    pkts      bytes target     prot opt in     out     source               destination
   67978  3727811 DOCKER     all  --  *      *       0.0.0.0/0            0.0.0.0/0            ADDRTYPE match dst-type LOCAL

Chain INPUT (policy ACCEPT 35 packets, 1848 bytes)
    pkts      bytes target     prot opt in     out     source               destination

Chain OUTPUT (policy ACCEPT 9 packets, 644 bytes)
    pkts      bytes target     prot opt in     out     source               destination
       0        0 DOCKER     all  --  *      *       0.0.0.0/0           !127.0.0.0/8          ADDRTYPE match dst-type LOCAL

Chain POSTROUTING (policy ACCEPT 0 packets, 0 bytes)
    pkts      bytes target     prot opt in     out     source               destination
     207    12532 MASQUERADE  all  --  *      !docker0  172.17.0.0/16        0.0.0.0/0
      32     2050 MASQUERADE  all  --  *      ens3    0.0.0.0/0            0.0.0.0/0

Chain DOCKER (2 references)
    pkts      bytes target     prot opt in     out     source               destination
       0        0 RETURN     all  --  docker0 *       0.0.0.0/0            0.0.0.0/0

```

```
wg show
interface: wghub
  public key: Tbe4jfa47nTRavU4E7YQdIXfR07/jo0dU/HaR7jyIls=
  private key: (hidden)
  listening port: 4473

peer: qlUnf9OccN........
  preshared key: (hidden)
  endpoint: 45.115.101.226:31112
  allowed ips: 10.214.122.10/32, fd16:1738:1200:4567::10/128
  latest handshake: 1 minute, 42 seconds ago
  transfer: 19.08 KiB received, 380 B sent

```

IPs were reducted.

```
ip address
2: ens3: <BROADCAST,MULTICAST,UP,LOWER_UP> mtu 1500 qdisc fq_codel state UP group default qlen 1000
    link/ether 52:13:022:a1:1a:12 brd ff:ff:ff:ff:ff:ff
    altname enp0s3
    inet REAL_EXTERNAL_IP_HERE/24 brd REAL_EXTERNAL_IP_HERE_ENDING_WTH.255 scope global noprefixroute ens3
       valid_lft forever preferred_lft forever
    inet6 2222:1234:ffff::1d64/48 scope global noprefixroute
       valid_lft forever preferred_lft forever
    inet6 fe80::2av:a539:c470:55c1/64 scope link noprefixroute
       valid_lft forever preferred_lft forever
```

So, as you can see, Wireguard sees connection but my phone that acts as a client can not get anything useful like a webpage or even result of `ping 8.8.8.8`.

**Comment by avently** [comment]
@burghardt ^

**Comment by wellWINeo** [comment]
@avently ran into same issue, did you solve it?
